,description,price,title,url
63,Программа с углубленной теорией и дополнительной практикой. Станете Frontend-разработчиком уровня Middle — уверенный специалист с зарплатой от 150 000 ₽,от 5223 ₽,Frontend-разработчик с нуля до Middle,https://gb.ru/geek_university/developer/programmer/frontend/master
64,"Станьте тем, кто создает игровые миры. Научитесь работать с графикой, продумывать сюжет и механики, удерживать интерес игрока и монтентизировать игры.",от 3170 ₽,Геймдизайнер с нуля до Pro,https://gb.ru/geek_university/games/game-designer-gb
65,Расширенная программа с углубленной теорией и дополнительной практикой. Станете менеджером маркетплейсов уровня Junior — младший специалист с зарплатой от 80 000 ₽,от 2550 ₽,Менеджер маркетплейсов с нуля до Junior,https://gb.ru/geek_university/marketing/e-commerce
66,Расширенная программа обучения с углубленной теорией и дополнительной практикой. Станете UX-дизайнером уровня Middle — уверенный специалист с зарплатой от 150 000 ₽,от 3772 ₽,UX/UI-дизайнер с нуля до Middle,https://gb.ru/geek_university/design/interface
67,"Научитесь продвигать и продавать товары в интернет-магазинах. на практике изучите работу с Ozon, Wildberries и Яндекс.Маркетом, и сможете гарантированно трудоустроиться",2121,Менеджер маркетплейсов: быстрый старт в профессии,https://gb.ru/geek_university/marketing/e-commerce-spec-gb
68,"Максимальное количество практики, дополнительные знания из других областей. Станете графическим дизайнером уровня Middle — уверенный специалист с зарплатой от 150 000 ₽",от 5223 ₽,Графический дизайнер с нуля до Middle,https://gb.ru/geek_university/design/graphic/master
69,"Изучите основы иллюстрации и выберите направление, в котором хотите развиваться как специалист: книжная или рекламная иллюстрация.",от 3589 ₽,Коммерческий иллюстратор,https://gb.ru/geek_university/design/illustrator-gb
70,Выберите профессию в тестировании в процессе обучения и станьте специалистом уровня Junior с зарплатой от 80 000 ₽,3707,Тестировщик с нуля до Junior,https://gb.ru/geek_university/developer/qa-engineer
71,Расширенная программа обучения с углубленной теорией и дополнительной практикой. Станете SMM-менеджером уровня Junior — младший специалист с зарплатой от 80 000 ₽,от 2550 ₽,SMM-менеджер с нуля до Junior,https://gb.ru/geek_university/marketing/smm-management
72,Вы научитесь с нуля разрабатывать архитектуру и создавать пользовательские интерфейсы мобильных приложений на базе Android,от 4049 ₽,Android-разработчик: быстрый старт в профессии,https://gb.ru/geek_university/developer/programmer/android-spec
73,"Вы изучите основы работы с BI-системами, научитесь создавать отчеты и дашборды, а также проводить анализ данных для принятия важных бизнес-решений",от 3005 ₽,BI-аналитик,https://gb.ru/geek_university/developer/analyst/bi
74,Расширенная программа обучения с углубленной теорией и дополнительной практикой. Станете 1C-разработчиком уровня Junior — младший специалист с зарплатой от 80 000 ₽,от 3114 ₽,1С-разработчик с нуля до Junior,https://gb.ru/geek_university/developer/programmer/1c-developer
75,"Выберите в процессе учебы, кем именно вы хотите стать в сфере Data Science: программистом, аналитиком, тестировщиком, менеджером по проектам или продуктам",4129,ИТ-специалист в сфере Data Science,https://gb.ru/geek_university/engineer/datascience
76,"Научитесь продвигать компании, продукты и услуги с помощью текста, сможете писать в различных жанрах и стилях, а также готовить контент-план",от 2550 ₽,Редактор,https://gb.ru/geek_university/marketing/copywriter
77,"Станьте тем, кто создает модели для кино и игр. Обучайтесь у экспертов индустрии, соберите 20 проектов для портфолио и начните творческую карьеру",от 4579 ₽,3D-художник,https://gb.ru/geek_university/design/3d-artist-gb
78,Углубленная теория и больше практики. в конце обучения станете цифровым дизайнером уровня Middle — уверенный специалист с зарплатой от 150 000 ₽,от 4129 ₽,Цифровой дизайнер с нуля до Middle,https://gb.ru/geek_university/design/digital/master
79,"Станьте режиссером в игровой индустрии: научитесь на практике объединять сюжет, графику, игровые механики и правила, работать с командами художников и разработчиков",13 777,Геймдизайнер,https://gb.ru/geek_university/design/game-design-spec
80,"Научитесь создавать трехмерные модели с нуля, на практике изучите работу программ для создания и рендеринга 3D объектов, научитесь работать в графических редакторах",от 4525 ₽,Специалист по 3D-моделированию,https://gb.ru/geek_university/design/3d-spec
81,"Научитесь создавать концепции, которые передают настроение и атмосферу. Изучите инструменты, наработайте портфолио и начните карьеру в играх и кино",от 4511 ₽,Концепт-художник,https://gb.ru/geek_university/design/concept-artist-gb
82,"Вы изучите инструменты селлера, получите пошаговый алгоритм для запуска продаж на маркетплейсе и стратегию развития бизнеса на год вперед",3 028,Как продавать на Wildberries,https://gb.ru/geek_university/marketing/wildberries-sales
83,Расширенная программа обучения с углубленной теорией и дополнительной практикой. Станете Android-разработчиком уровня Junior — младший специалист с зарплатой от 80 000 ₽,от 4525 ₽,Android-разработчик с нуля до Junior,https://gb.ru/geek_university/developer/programmer/android
84,"Вы с нуля научитесь работать с финансами и отчетностью. Изучите «1С:Бухгалтерия 8, редакция 3.0» и «1С:ЗУП», сможете устроиться в компанию или работать на аутсорсе",6 748,Бухгалтер,https://gb.ru/geek_university/management/accountant
